Title	publication_date	Blog_author
Knowledgeowl vs Document360: All you need to know	2021-06-23 00:00:00	Pradeepa somasundaram
Use tags to organise your knowledge base	2021-06-17 00:00:00	Selvaraaju Murugesan
Process Documentation Guide with Examples & Templates	2021-06-11 00:00:00	Pradeepa somasundaram
Guru Vs Document360 : A Side-by-Side Comparison	2021-06-11 00:00:00	Pradeepa somasundaram
The Role of Technology in Documentation with Andrii Tserkovn...	2021-06-10 00:00:00	Gowri Ramkumar
How to Import Word Document into Knowledge Base	2021-06-08 00:00:00	Selvaraaju Murugesan
Ticket Deflection: The new age coin counter to reduce inboun...	2021-06-02 00:00:00	Pradeepa somasundaram
A Clever Trick to Manage Documentation at Scale	2021-05-31 00:00:00	Selvaraaju Murugesan
Agile Technical Documentation Workflow with Hannah Gilberg, ...	2021-05-27 00:00:00	Gowri Ramkumar
Tips to keep a healthy knowledge base	2021-05-24 00:00:00	Selvaraaju Murugesan
Best practices: Knowledge management in Learning Management ...	2021-05-21 00:00:00	Document360 Team
Single Sign-On (SSO) for Document360 Knowledge Base	2021-05-18 00:00:00	Document360 Team
Three Steps To High Quality Documentation with Jamie Roddy, ...	2021-05-17 00:00:00	Gowri Ramkumar
What’s new in Document360? – April 2021 Product update	2021-05-13 00:00:00	Kingson S
Document360 Awards and Accolades	2021-05-07 00:00:00	Pradeepa somasundaram
Leveraging Artificial Intelligence in knowledge management	2021-04-30 00:00:00	Selvaraaju Murugesan
Architecting User Journey’s with Steve Bream, Document...	2021-04-29 00:00:00	Gowri Ramkumar
How Human & Chatbots can optimize your customer support	2021-04-27 00:00:00	Document360 Team
Drift+ Document360 – The integration that your support...	2021-04-22 00:00:00	Document360 Team
10 Essential Steps in writing SOPs	2021-04-19 00:00:00	Document360 Team
API-First & the OAS Approach for Technical Documentatio...	2021-04-16 00:00:00	Gowri Ramkumar
Top 10 SaaS knowledge base examples to learn from	2021-04-02 00:00:00	Document360 Team
How to Automate Documentation with Patrick Hammond, Project ...	2021-03-31 00:00:00	Gowri Ramkumar
Corporate Wiki Vs Knowledge Base-A Guide For SaaS Business	2021-03-23 00:00:00	Document360 Team
How GitHub Ensures Quality Documentation with Lucie Le Naour...	2021-03-19 00:00:00	Gowri Ramkumar
Remote Onboarding Best Practices for New Hires	2021-03-19 00:00:00	Document360 Team
Microsoft Teams and Document360 – a match made in technology!	2021-03-17 00:00:00	Document360 Team
Knowledge Management in large consulting firms-Mckinsey, Ern...	2021-03-12 00:00:00	Document360 Team
A User-Centric Approach for High-Quality Documentation with ...	2021-03-04 00:00:00	Gowri Ramkumar
Document360 is awarded ’Top Rated Software’ by G2.Com	2021-03-03 00:00:00	Document360 Team
Effective use of a Knowledge Base as a Teaching Supplement	2021-02-22 00:00:00	Document360 Team
The Role of the Editor in Technical Documentation With Mike ...	2021-02-19 00:00:00	Gowri Ramkumar
User-Friendly Documentation with Sara Tilly of Infobip	2021-02-16 00:00:00	Gowri Ramkumar
Document360 Makes it to Latka 250 Fastest Growing SaaS Compa...	2021-02-15 00:00:00	Document360 Team
How an internal knowledge base can fix disrupted communication	2021-02-13 00:00:00	Pradeepa somasundaram
How to write a SOP documentation for internal communications	2021-02-12 00:00:00	Document360 Team
Cookie Consent: Here is all you need to know	2021-02-03 00:00:00	Sruti Sukumar
Documentation Knowledge Management with Patrick Martin, Seni...	2021-02-03 00:00:00	Gowri Ramkumar
Confluence Vs Document360 – A Detailed Comparison	2021-01-29 00:00:00	Document360 Team
Smart Bars – When and where to use during knowledge sharing?	2021-01-27 00:00:00	Document360 Team
Improving Retention (From the First Hello) with Gowri Ramkum...	2021-01-25 00:00:00	Gowri Ramkumar
12 WordPress knowledge base plugins and themes compared	2021-01-22 00:00:00	Document360 Team
Learning Technical Writing with Nikita Dhulekar, a Business ...	2021-01-21 00:00:00	Gowri Ramkumar
Connect Quickly: Document360 + Google Chrome extension	2021-01-18 00:00:00	Kingson S
What’s new in Document360? January 2021 Product update	2021-01-12 00:00:00	Kingson S
Technical Writing Guidelines with Anne Tarnoruder of Synopsys	2021-01-08 00:00:00	Gowri Ramkumar
The benefits of a health sector knowledge management	2021-01-07 00:00:00	Document360 Team
Enable External Forwarding in Microsoft 365	2020-12-29 00:00:00	Saravana Kumar
Choosing a knowledge base for your banking institution	2020-12-27 00:00:00	Document360 Team
Agile Technical Documentation Style Guides with Dr Anu Singh...	2020-12-22 00:00:00	Gowri Ramkumar
Top 11 ecommerce knowledge base examples to learn from	2020-12-17 00:00:00	Document360 Team
The Creative Side of Writing Technical Documentation with Ma...	2020-12-16 00:00:00	Gowri Ramkumar
Essential writing tools to write Manual, Book, or any Document	2020-12-16 00:00:00	Document360 Team
3 Customer Onboarding Best Practices to Improve Your Convers...	2020-12-11 00:00:00	Document360 Team
How To Create Quality Documentation with Manasi Gandhi of IBM	2020-12-02 00:00:00	Gowri Ramkumar
How an Ecommerce Knowledge Base can Supercharge your Business	2020-11-30 00:00:00	Document360 Team
Knowledge Base Management Is A Synonym For Worthy Investment	2020-11-26 00:00:00	Document360 Team
Optimising Technical Writing through Strategic Planning with...	2020-11-19 00:00:00	Gowri Ramkumar
How to create an FAQ Page for Your Company: Tips & Benefits	2020-11-19 00:00:00	Jubina Prabhakaran
The Benefits of Open-sourcing Content with Andrew Etter of A...	2020-11-12 00:00:00	Gowri Ramkumar
What is Software Documentation? Its types and Best practices	2020-11-10 00:00:00	Document360 Team
Unifying the technical documentation with Sadhana S of IBM	2020-11-05 00:00:00	Gowri Ramkumar
Guide to Reduce Customer Support Tickets	2020-10-30 00:00:00	Jubina Prabhakaran
Importance of Formatting and Presentation In Technical Writi...	2020-10-28 00:00:00	Gowri Ramkumar
SaaS Documentation: Drive Your Business Forward	2020-10-22 00:00:00	Document360 Team
Keeping Documentation Simple and Readable with Aditi Khancha...	2020-10-21 00:00:00	Gowri Ramkumar
Customer Service Knowledge Base Best Practices in 7 Steps	2020-10-09 00:00:00	Document360 Team
Innovating In Technical Writing with Marco Cacciacarro from ...	2020-10-07 00:00:00	Gowri Ramkumar
Top Knowledge Management Platform for your Product Documenta...	2020-09-30 00:00:00	Document360 Team
Collaborative Technical Documentation & Technological I...	2020-09-28 00:00:00	Gowri Ramkumar
User-Centric Documentation with Sreya Dutta of Clover Network	2020-09-23 00:00:00	Gowri Ramkumar
The Expert’s Guide To Create A Self-Service Knowledge Base	2020-09-18 00:00:00	Document360 Team
Treating Documentation As A Product And Collaborative Effort...	2020-09-15 00:00:00	Gowri Ramkumar
What’s new in Document360? – August 2020 Product Update	2020-09-14 00:00:00	Saravana Kumar
Manage knowledge base assets using the new Document360 Drive	2020-09-11 00:00:00	Kingson S
Career Trajectories For Technical Writer’s with Jordan...	2020-09-09 00:00:00	Gowri Ramkumar
Building Multilingual Knowledge base using Document360	2020-09-04 00:00:00	Kingson S
Generating Organic Traffic Through Documentation with Arshab...	2020-09-02 00:00:00	Gowri Ramkumar
Best Customer Service Support Tools in 2024	2020-08-28 00:00:00	Jubina Prabhakaran
Being A Startup’s Sole Technical Writer with Sarah Day of ...	2020-08-26 00:00:00	Gowri Ramkumar
Optimizing The Documentation Process with Raghuram Pandurang...	2020-08-19 00:00:00	Gowri Ramkumar
How to Write Standard Operating Procedure with Examples ...	2020-08-16 00:00:00	Saravana Kumar
Do You Really Need Document Management Software?	2020-08-14 00:00:00	Document360 Team
UX Writing & Technical Documentation In A Digital Space...	2020-08-11 00:00:00	Gowri Ramkumar
Top 15 Knowledge Management Software for 2024	2020-08-09 00:00:00	Document360 Team
The Important Factors in Documentation with Rick Teplitz of ...	2020-08-05 00:00:00	Gowri Ramkumar
Essential Qualities Of A Technical Writer With Ellis Pratt o...	2020-07-29 00:00:00	Gowri Ramkumar
Migrate Your Knowledge Base Articles Without Affecting Searc...	2020-07-27 00:00:00	Document360 Team
Knowing Your Documentation Audience with Naomi Papoushado of...	2020-07-22 00:00:00	Gowri Ramkumar
Business Value Of Tech Documentation with Sarah O’Keefe of...	2020-07-15 00:00:00	Gowri Ramkumar
Internal Customer Service Best Practices	2020-07-10 00:00:00	Jubina Prabhakaran
Documentation Being A Factor In The Product Life Cycle with ...	2020-07-08 00:00:00	Gowri Ramkumar
7 Best Examples of User Documentation & Help Guides	2020-07-07 00:00:00	Jubina Prabhakaran
The importance of documentation with Tanja Lorber of Stegman...	2020-07-01 00:00:00	Gowri Ramkumar
Should You Host Your Own Knowledge Base?	2020-06-30 00:00:00	Document360 Team
Technical Writing Strategies with Jack Molisani of  ProSprin...	2020-06-24 00:00:00	Gowri Ramkumar
Looking for alternate to Intercom (Articles) in 2024?	2020-06-19 00:00:00	Saravana Kumar
Developing Your Technical Writing Skills with Andrés Altami...	2020-06-17 00:00:00	Gowri Ramkumar
The Power Of Detailed Documentation with Shilpa Garg of Workday	2020-06-10 00:00:00	Gowri Ramkumar
Five Amazing Key Insights From The Knowledgebase Ninjas Podc...	2020-06-09 00:00:00	Gowri Ramkumar
Best Alternate to Help Scout (Docs)	2020-06-08 00:00:00	Saravana Kumar
Creating Effective Documentation with Raj Kiran of OpenText	2020-06-03 00:00:00	Gowri Ramkumar
The Importance Of User Navigation with David Forsythe of Mav...	2020-05-27 00:00:00	Gowri Ramkumar
Understanding Your User Personas with Aditi Kashikar of Auto...	2020-05-20 00:00:00	Gowri Ramkumar
Five Key Insights From The Knowledgebase Ninjas Podcast In A...	2020-05-15 00:00:00	Gowri Ramkumar
Creating Quality Documentation through Quality Assurance wit...	2020-05-13 00:00:00	Gowri Ramkumar
Why do SaaS companies rely on a customer knowledge base to g...	2020-05-11 00:00:00	Document360 Team
Increasing Documentation Searchability with Gideon Behrensme...	2020-05-06 00:00:00	Gowri Ramkumar
How To Put Your Audience First with Christopher Gales of Splunk	2020-05-01 00:00:00	Gowri Ramkumar
What’s new in Document360? – April 2020 Product Update	2020-04-30 00:00:00	Saravana Kumar
How these Top SaaS companies deliver market-leading customer...	2020-04-30 00:00:00	Document360 Team
How To Improve Your Documentation Process with Sindhu Surent...	2020-04-27 00:00:00	Gowri Ramkumar
The Industries that value Technical Writers the Most	2020-04-24 00:00:00	Document360 Team
Best Way To Process Documentation with Kavitha Kandappan of AMD	2020-04-24 00:00:00	Gowri Ramkumar
The Evolution of Hubspot’s Documentation with Megan Dr...	2020-04-22 00:00:00	Gowri Ramkumar
How a Self-Service Knowledge Base is the Key to Scaling your...	2020-04-17 00:00:00	Document360 Team
Technical Documentation with Tom Johnson of Amazon	2020-04-15 00:00:00	Gowri Ramkumar
Earn the Everlasting Trust of your Customers with a Self-Ser...	2020-04-10 00:00:00	Pradeepa somasundaram
Customer Documentation with Jennifer Lambourne of Monzo Bank	2020-04-08 00:00:00	Gowri Ramkumar
What’s new in Document360? – Q1 2020 product update	2020-04-05 00:00:00	Saravana Kumar
Training Documentation Specialist with Keith Johnson of Info...	2020-04-03 00:00:00	Gowri Ramkumar
The Importance Of CSAT Score with Allan Duquette of Proposify	2020-04-01 00:00:00	Gowri Ramkumar
What If You’d Switch To A Knowledge Base Instead of Wiki?	2020-03-27 00:00:00	Document360 Team
User Documentation with Karissa Van Baulen, Support Speciali...	2020-03-27 00:00:00	Gowri Ramkumar
How To Get Into Technical Writing With Colum McAndrew of Mim...	2020-03-25 00:00:00	Gowri Ramkumar
How Document360 can help improve Remote Work and Internal Co...	2020-03-23 00:00:00	Saravana Kumar
9 Customer Support Faux Pas That Enrage Customers (And What ...	2020-03-19 00:00:00	Document360 Team
Convincing your Developers to Write Technical Product Docume...	2020-03-13 00:00:00	Document360 Team
Minimizing Content With Gavin Austin of Salesforce	2020-03-11 00:00:00	Gowri Ramkumar
Finding The time To Write Software Documentation In A Busy S...	2020-03-06 00:00:00	Document360 Team
Managing Shareholders With Chris Ward of Ethereum	2020-03-04 00:00:00	Gowri Ramkumar
Transform Haters Into Advocates: The Power Of Customer Suppo...	2020-02-28 00:00:00	Document360 Team
Documentation Is An Option With Aaron Collier of Kiwi.com	2020-02-26 00:00:00	Gowri Ramkumar
8 Reasons That Companies Fail To Adopt Self-Service Support ...	2020-02-22 00:00:00	Document360 Team
Unnecessary Words With Nick Whittaker of Wolters Kluwer	2020-02-19 00:00:00	Gowri Ramkumar
Writers Should Write Less With Nibu Thomas of Whatfix	2020-02-12 00:00:00	Gowri Ramkumar
5 real-life examples of Knowledge Management success you can...	2020-02-11 00:00:00	Catherine Heath
How to turn off URL previews in Microsoft Teams?	2020-01-31 00:00:00	Document360 Team
Users Want Self Help With Khurshid Alam of Quick Heal Techno...	2020-01-31 00:00:00	Gowri Ramkumar
Documentation Isn’t Just One Thing With Daniele Procida of...	2020-01-31 00:00:00	Gowri Ramkumar
Improving Software Documentation With Arjan Ros of Reynen Co...	2020-01-31 00:00:00	Gowri Ramkumar
Welcome To Knowledgebase Ninjas With Saravana Kumar of Docum...	2020-01-31 00:00:00	Gowri Ramkumar
Introductory Guide to Markdown for Documentation Writers	2020-01-31 00:00:00	Catherine Heath
Top 10 Must-Attend International SaaS Conferences in 2020 an...	2020-01-22 00:00:00	Pradeepa somasundaram
Creating the Perfect Style Guide for your SaaS Knowledge Base	2020-01-11 00:00:00	Document360 Team
Recap of 2019 — Document360	2020-01-03 00:00:00	Pradeepa somasundaram
Top Email Software to Advance Your Customers’ Knowledge Base	2019-12-19 00:00:00	Christeen Paul
Deep dive into your customers’ psyche with knowledge base ...	2019-12-12 00:00:00	Document360 Team
Using a Knowledge Base To Drive SaaS Business Growth	2019-12-02 00:00:00	Document360 Team
What to put beneath your support— HelpCenter (+Examples)	2019-11-29 00:00:00	Pradeepa somasundaram
Insights from NASSCOM Product Conclave: 2019	2019-11-15 00:00:00	Venkatraman Chandrasekaran
From an idea to over 100 paying customers in less than 2 years	2019-11-13 00:00:00	Saravana Kumar
Need Help? Sort it with the In-App assistance	2019-11-01 00:00:00	Pradeepa somasundaram
Product Hunt Launch - The D-Day preparation!	2019-10-29 00:00:00	Saravana Kumar
SaaStock 2019 recap: 7 steps to stand out Success	2019-10-21 00:00:00	Pradeepa somasundaram
What Are Technical Writing Tools?	2019-10-11 00:00:00	Document360 Team
How to Create a Knowledge Base in 9 Easy Steps	2019-10-03 00:00:00	Document360 Team
How to Create an Internal Knowledge Base	2019-10-02 00:00:00	Document360 Team
5 Best Knowledge Management System Examples	2019-10-01 00:00:00	Jubina Prabhakaran
What is Call Center Knowledge Base Software and Why is it Us...	2019-09-30 00:00:00	Document360 Team
Zoho Knowledge Base Software Alternatives You Should Consider	2019-09-27 00:00:00	Pradeepa somasundaram
Complete Attendee Guide to SaaStock2019,Dublin	2019-09-26 00:00:00	Pradeepa somasundaram
How to Unlock the True Power of a Knowledge Sharing Platform	2019-09-23 00:00:00	Document360 Team
7 Best Knowledge-Sharing Tools in 2024	2019-09-20 00:00:00	Document360 Team
Why Knowledge Sharing Tools Are Critical to Reducing Interna...	2019-09-18 00:00:00	Document360 Team
“Docs-like-code” or “Docs-as-code” – Is it worth the hassle?	2019-09-18 00:00:00	Saravana Kumar
How to write the perfect error message- WritetheDocs 2019, P...	2019-09-16 00:00:00	Pradeepa somasundaram
What the Modern Customer Expects From SAAS Customer Support	2019-09-05 00:00:00	Document360 Team
5 Great Ways to Maximize Knowledge Sharing in Your Business	2019-09-04 00:00:00	Document360 Team
How Knowledge Sharing Tools Empower Your Employees	2019-09-03 00:00:00	Document360 Team
5 Great Ways to Develop Top-Quality SAAS Customer Support	2019-09-02 00:00:00	Document360 Team
5 Tools Commonly Used In Knowledge Management	2019-08-22 00:00:00	Jubina Prabhakaran
Step By Step Guide To Creating Knowledge Sharing Culture in ...	2019-08-21 00:00:00	Jubina Prabhakaran
How to Get Employee Buy-In for Your Knowledge Base	2019-08-20 00:00:00	Document360 Team
How Social Media Helps Deliver Great Customer Support	2019-08-19 00:00:00	Document360 Team
Why Developing a Knowledge Sharing Culture Is Critical for Y...	2019-08-16 00:00:00	Document360 Team
How a Knowledge Sharing Platform Upskills Your Workforce	2019-08-15 00:00:00	Document360 Team
The Importance of Knowledge Sharing: Why Your Employees Need...	2019-08-14 00:00:00	Document360 Team
The Definition of Knowledge Sharing – Just What Is It?	2019-08-13 00:00:00	Document360 Team
The Best Customer Support Tools to Achieve Business Success	2019-08-12 00:00:00	Document360 Team
The Essential Customer Experience Support Tools You Need to ...	2019-08-08 00:00:00	Document360 Team
Top 10 Tips for Great Technical Writing	2019-08-01 00:00:00	Document360 Team
How Knowledge Management Application Tools Improve Employee ...	2019-07-26 00:00:00	Document360 Team
The Critical Role of Online Customer Support Tools	2019-07-25 00:00:00	Document360 Team
The Role of Metrics in SAAS Customer Support	2019-07-24 00:00:00	Document360 Team
How You Can Develop a Knowledge Sharing Culture in Your Busi...	2019-07-23 00:00:00	Document360 Team
SAAS Customer Support Best Practices Quick Guide	2019-07-22 00:00:00	Document360 Team
How Customer Support Tools for Social Media Can Take Your Cu...	2019-07-20 00:00:00	Document360 Team
The SAAS Customer Support Metrics You Need to Measure	2019-07-19 00:00:00	Document360 Team
Embracing the Data: The SAAS Customer Support Metrics You Ne...	2019-07-19 00:00:00	Document360 Team
How Knowledge Sharing in Your Organization Improves Performance	2019-07-19 00:00:00	Document360 Team
Why You Can’t Ignore the Benefits of Knowledge Sharing Tec...	2019-07-18 00:00:00	Document360 Team
Why Defining Your SAAS Customer Support Metrics Is Key to Su...	2019-07-17 00:00:00	Document360 Team
The Definition of Knowledge Management Tools: Just what are ...	2019-07-16 00:00:00	Document360 Team
5 SAAS Customer Support Costs You Can’t Afford to Ignore	2019-07-15 00:00:00	Document360 Team
The Secrets to Reducing Your SAAS Customer Support Costs	2019-07-11 00:00:00	Document360 Team
Embracing the Data: The SAAS Customer Support Metrics You Ne...	2019-07-10 00:00:00	Document360 Team
How to Manage Your SAAS Customer Support Costs	2019-07-09 00:00:00	Document360 Team
Unlock the Full Potential of Your Expertise with a Knowledge...	2019-07-08 00:00:00	Document360 Team
The Benefits of Adopting Knowledge Management Tools and Tech...	2019-07-05 00:00:00	Document360 Team
How Knowledge Management Will Evolve in 2019	2019-07-04 00:00:00	Document360 Team
5 Ways Customer Service Skills Influence Your Bottom Line	2019-06-28 00:00:00	Document360 Team
Why Customer Service Skills are critical to your business su...	2019-06-17 00:00:00	Tom Hooker
The Role of Customer Service in the Digital World	2019-06-14 00:00:00	Tom Hooker
How Knowledge Management Reduces Your Service Costs	2019-06-14 00:00:00	Tom Hooker
Why Knowledge Management is key to helping your customers he...	2019-06-10 00:00:00	Jade Emmons
How Knowledge Management Can Help You and Your Customers	2019-05-24 00:00:00	Tom Hooker
The power of Knowledge Management: Why you need to document ...	2019-05-24 00:00:00	Jade Emmons
Where to Find Ideas for Knowledge Base Articles	2019-04-26 00:00:00	Jade Emmons
Mar 2019 Product Update	2019-04-25 00:00:00	Vishnu Balachandran
Top 9 Document Collaboration tools for Growing Teams	2019-04-23 00:00:00	Tom Hooker
Top 5 Customer Feedback Tools Compared	2019-04-12 00:00:00	Jade Emmons
B2B Marketing Expo 2019- London	2019-04-01 00:00:00	Rochelle Saldanha
Top Tools for Managing Remote Customer Support Teams	2019-03-29 00:00:00	Tom Hooker
10 essential customer service skills that drive business growth	2019-03-26 00:00:00	Catherine Heath
5 Effective Ways To Get Your Customer To Provide Feedback	2019-03-22 00:00:00	Jade Emmons
Open Source Help Authoring Tools: The Pros and Cons	2019-03-15 00:00:00	Jade Emmons
Feb 2019 Product Update – File Manager, Notification c...	2019-03-14 00:00:00	Vishnu Balachandran
Why “FREE” Isn’t Your Answer to Help Authoring Tools	2019-03-13 00:00:00	Catherine Heath
Feature Spotlight – API in Document360	2019-03-11 00:00:00	Rochelle Saldanha
Best Help Authoring Tools for Growing Tech Teams	2019-03-08 00:00:00	Catherine Heath
Key differences between Adobe RoboHelp and Document360	2019-03-01 00:00:00	Catherine Heath
Best Affordable SaaS Customer Support Software	2019-02-20 00:00:00	Tom Hooker
Feature Spotlight – File Manager in Document360	2019-02-18 00:00:00	Rochelle Saldanha
3 Crucial Disadvantages to HelpNDoc Help Authoring Tool	2019-02-18 00:00:00	Catherine Heath
What Is SaaS Customer Support?	2019-02-16 00:00:00	Tom Hooker
What is Customer Churn and 9 Proven Ways to Reduce It	2019-02-15 00:00:00	Noel Ceta
Why did we implement the emoji icons in Document360?	2019-02-12 00:00:00	Haripriya Loganathan
Import and Export Documentation within Document360	2019-02-12 00:00:00	Kuzhali Maheswaran
Feature Spotlight – Notifications in Document360	2019-02-12 00:00:00	Rochelle Saldanha
How to Measure SaaS Customer Success	2019-02-11 00:00:00	Tom Hooker
January 2019 Product Update: Notification channel, @mention...	2019-02-08 00:00:00	Vishnu Balachandran
Feature Spotlight – Analytics in Document360	2019-02-04 00:00:00	Rochelle Saldanha
Feature Spotlight – Custom Footer Navigation in Document360	2019-01-28 00:00:00	Rochelle Saldanha
What are the Biggest Customer Service Challenges Faced? Solu...	2019-01-25 00:00:00	Murali S
Feature Spotlight – Markdown Editor in Document360	2019-01-24 00:00:00	Rochelle Saldanha
How Analytics Plays a Vital Role in Documentation?	2019-01-16 00:00:00	Vishnu Balachandran
Best Help Authoring Tools (HAT) & Software Compared	2019-01-14 00:00:00	Catherine Heath
How Caching works in Document360?	2019-01-11 00:00:00	Sunny Sharma
December 2018 Product Update: Analytics, Related Articles, C...	2019-01-10 00:00:00	Sunny Sharma
Top 10 International SaaS Conferences You Should Attend in 2...	2019-01-02 00:00:00	Document360 Team
5 Ways Your SaaS Customer Support Team Can Save Time	2018-12-28 00:00:00	Tom Hooker
Saravana Kumar, Founder & CEO Talks About the Inspirati...	2018-12-26 00:00:00	Helen Sheeba
Document360’s Feature Spotlight – Category Manager	2018-12-20 00:00:00	Rochelle Saldanha
10 Knowledge Base Software Best Practice Examples	2018-12-19 00:00:00	Catherine Heath
What Is a Knowledge Base and Why Do I Need One?	2018-12-18 00:00:00	Noel Ceta
How to SEO Your Knowledge Base Articles	2018-12-17 00:00:00	Jade Emmons
November 2018 Product Update: Caching, Author Page, Offline ...	2018-12-10 00:00:00	Helen Sheeba
Best Practices to Improve Knowledge Base Information Archite...	2018-12-07 00:00:00	Tom Hooker
Free Internal Knowledge Base Software Options Reviewed	2018-12-07 00:00:00	Tom Hooker
Using Zendesk Internal Knowledge Base? Here are the Pros and...	2018-12-06 00:00:00	Tom Hooker
Document360’s Feature Spotlight – How to Configure C...	2018-12-05 00:00:00	Rochelle Saldanha
Document360’s Feature Spotlight – How to Add Custom CSS ...	2018-11-29 00:00:00	Rochelle Saldanha
5 Internal Knowledge Base Software Options Reviewed	2018-11-29 00:00:00	Tom Hooker
5 Examples of Outstanding SaaS Customer Support	2018-11-29 00:00:00	Tom Hooker
The Important Differences Between Help Desk and Knowledge Ba...	2018-11-22 00:00:00	Jade Emmons
Grab Document360 at a Huge Discount – Black Friday  ...	2018-11-22 00:00:00	Helen Sheeba
Document360’s Feature Spotlight – Bulk Operations	2018-11-16 00:00:00	Rochelle Saldanha
Open Source Knowledge Base: What’s it, Benefits & Top Tools	2018-11-15 00:00:00	Jade Emmons
10 Customer Support Best Practices for SaaS Companies	2018-11-13 00:00:00	Jade Emmons
Document360’s Feature Spotlight – Backup and Restore	2018-11-08 00:00:00	Rochelle Saldanha
October 2018 Product Update: Edit and Undo Published Article...	2018-11-02 00:00:00	Helen Sheeba
Strategic Approach to Use Knowledge Base as Marketing Tool (...	2018-10-24 00:00:00	Noel Ceta
Document360’s Action Plans after SaaStock 2018	2018-10-23 00:00:00	Duncan Barker
Document360’s Feature Spotlight – Private Knowledge Base	2018-10-15 00:00:00	Rochelle Saldanha
Complete Attendee Guide to SaaStock 2018	2018-10-10 00:00:00	Pradeepa somasundaram
The Ins and Outs of Using Markdown for Technical Writing	2018-10-09 00:00:00	Catherine Heath
6 Effective Team Collaboration Tools for Internal Communication	2018-10-04 00:00:00	Catherine Heath
September 2018 Product Update: UI Revamp, Bulk Operation and...	2018-10-01 00:00:00	Rochelle Saldanha
Document360’s Feature Spotlight – Landing Page	2018-09-27 00:00:00	Rochelle Saldanha
Learn the Knowledge Base Best Practices from Twilio’s Deve...	2018-09-25 00:00:00	Catherine Heath
Document360’s Feature Spotlight – Versioning	2018-09-18 00:00:00	Rochelle Saldanha
The Biggest Drawbacks of Using Wiki as Knowledge Base Software	2018-09-06 00:00:00	Christina Comben
August 2018 Product Update: Landing Page with Category Secti...	2018-09-03 00:00:00	Rochelle Saldanha
New Chrome “Not Secure” Warning has Consequences...	2018-08-16 00:00:00	Catherine Heath
Online Knowledge Base Best Practices	2018-08-06 00:00:00	Christina Comben
