Title	publication_date	Blog_author
July 2018 Product Update: Article Search in Portal, Category...	2018-08-03 00:00:00	Sriram Hariharan
How to Integrate Your Self-service Support and One-on-one Su...	2018-07-31 00:00:00	Catherine Heath
Why Document360 is better than INTERCOM Articles for Knowled...	2018-07-26 00:00:00	Catherine Heath
Top 5 Uses of Best Knowledge Base Tools for SaaS Product	2018-07-19 00:00:00	Christina Comben
Our Experiences With Algolia QPS Violation	2018-07-18 00:00:00	Sunny Sharma
Disadvantage of Using Free Knowledge Base Software for Your ...	2018-07-17 00:00:00	Catherine Heath
Beginners Guide to Knowledge Base Organisation in a Structur...	2018-07-12 00:00:00	Christina Comben
13 Most Popular Tools for Technical Writing	2018-07-11 00:00:00	Sriram Hariharan
Pros and Cons of SharePoint Knowledge Base Software	2018-07-05 00:00:00	Catherine Heath
June 2018 Product Update: SSL for Custom Domain, Embedding V...	2018-07-04 00:00:00	Sriram Hariharan
6 Simple Steps to Build Perfect Knowledge Base Content Strategy	2018-07-03 00:00:00	Christina Comben
Breakfast meeting with Adi Tatarko (Founder of Houzz) –...	2018-06-29 00:00:00	Saravana Kumar
What Value Does an Independent SaaS Knowledge Base Software ...	2018-06-27 00:00:00	Saravana Kumar
Top 20+ SaaS Products For Startups To Consider	2018-06-22 00:00:00	Sriram Hariharan
7 Ways to Optimize Your Knowledge Base Content to Get More V...	2018-06-21 00:00:00	Christina Comben
Super Handy Publishing Checklist for SaaS User Documentation	2018-06-19 00:00:00	Catherine Heath
Document360 at Startup Grind Europe Conference, London 2018	2018-06-14 00:00:00	Rochelle Saldanha
Document360 at Kent B2B Ashford Event 2018 – A Recap	2018-06-12 00:00:00	Rochelle Saldanha
May 2018 Product Update: Pricing Subscription Plans, Private...	2018-06-06 00:00:00	Sriram Hariharan
Knowledge Base Analysis of 8 Top SaaS Companies	2018-06-05 00:00:00	Catherine Heath
GDPR Update: How We’re Taking Care of Your Data	2018-05-31 00:00:00	Gowri Ramkumar
7 Benefits of Having a Good Knowledge Base	2018-05-29 00:00:00	Christina Comben
Tear Down of Hubspot’s Terrifically Comprehensive Know...	2018-05-23 00:00:00	Catherine Heath
How to Write an Incredible Knowledge Base Article	2018-05-17 00:00:00	Christina Comben
Recap of Write the Docs Portland Conference 2018	2018-05-15 00:00:00	Catherine Heath
16 Knowledge Base Trends & Statistics To Consider in 2024	2018-05-08 00:00:00	Christina Comben
Tear Down of Stripe’s Legendary Developer Knowledge Base	2018-05-01 00:00:00	Catherine Heath
How to Understand What Your Customers are Searching for in Y...	2018-04-24 00:00:00	Christina Comben
7 Reasons Your Knowledge Base Will Increase Productivity	2018-04-19 00:00:00	Christina Comben
SaaS Knowledge Base Solutions: Are They Worth It?	2018-04-16 00:00:00	Catherine Heath
Where Can I Get Ideas for My Knowledge Base?	2018-04-11 00:00:00	Christina Comben
5 Excuses for Not Having Company Knowledge Base Software	2018-04-04 00:00:00	Christina Comben
Using WordPress as Knowledge Base: The Good, The Bad and The...	2018-03-30 00:00:00	Catherine Heath
Super SEO Tactics to Optimize Your Knowledge Base for Search	2018-03-20 00:00:00	Catherine Heath
How to Create a Good Internal Knowledge Base	2018-03-15 00:00:00	Christina Comben
7 Essential Features to Look for in a Knowledge Base Software	2018-03-08 00:00:00	Christina Comben
How to Create an Intuitive Product Documentation for Your Cu...	2018-02-28 00:00:00	Catherine Heath
Today’s Customers Prefer Self-service Over the Human Touch	2018-02-22 00:00:00	Catherine Heath
Adapt the “Docs Like Code” Approach to Supercharge Your ...	2018-02-14 00:00:00	Catherine Heath
Make Documentation a Core Part of Your Minimum Viable Product	2018-02-09 00:00:00	Catherine Heath
How to Outsource Your SaaS Product Documentation to Freelancers	2018-02-06 00:00:00	Lisamarie Lamb
The Untapped Power of Product Documentation for Marketing Yo...	2018-02-02 00:00:00	Catherine Heath
Agile SaaS Documentation: 5 Key Principles to Supercharge Yo...	2018-01-30 00:00:00	Catherine Heath
Create Killer SaaS Product Documentation for Your Customers	2018-01-23 00:00:00	Catherine Heath
Birth of Document360 – The Inside Story Behind Our 14 ...	2017-12-19 00:00:00	Saravana Kumar
