Title	publication_date	Blog_author
Technical Writing Guidelines to Create AI Friendly Content	2024-01-11 00:00:00	Selvaraaju Murugesan
Knowledge Management for Organizational Success with Eduarda...	2024-01-08 00:00:00	Gowri Ramkumar
2023 in Review: A Year of Transformation to AI	2024-01-05 00:00:00	Pratiksha Ramkumar
How to Improve Healthcare Process	2023-12-29 00:00:00	Jubina Prabhakaran
A Guide to Create Quick Reference Guide (Tips and Tools)	2023-12-29 00:00:00	Pradeepa somasundaram
Must-Attend Technical Writing Conferences of 2024	2023-12-27 00:00:00	Pratiksha Ramkumar
Process Improvement Tools: Enhancing Efficiency and Effectiv...	2023-12-21 00:00:00	Pratiksha Ramkumar
Crafting quality product documentation with Sofia Emelianova...	2023-12-05 00:00:00	Gowri Ramkumar
The Role of Knowledge Management in the Hospitality Industry	2023-11-29 00:00:00	Pradeepa somasundaram
Beyond Basic Search: Leveraging AI for Enhanced Knowledge Na...	2023-11-28 00:00:00	Thiruthani Ravichandran
Impact of ChatGPT enabled knowledge base in call centers	2023-11-15 00:00:00	Selvaraaju Murugesan
Guide to Creating a Single Source of Truth	2023-11-13 00:00:00	Pradeepa somasundaram
Top Black Friday and Cyber Monday SaaS Deals of 2023	2023-11-06 00:00:00	Pratiksha Ramkumar
Document360 2.0: Transforming your Knowledge Experience	2023-11-03 00:00:00	Mohamed Shakheen
Document360 Vs Traditional Authoring Tools ( DITA XML)	2023-11-01 00:00:00	Arunkumar Kumaresan
Exploring the Significance of Knowledge Base Dashboard Insights	2023-10-30 00:00:00	Thiruthani Ravichandran
Employee intranet: Why does it matter to your employees?	2023-10-30 00:00:00	Pratiksha Ramkumar
How to build your own custom ChatGPT for your company’...	2023-10-27 00:00:00	Selvaraaju Murugesan
8 Best IT Documentation Tools for DevOps in 2024	2023-10-27 00:00:00	Kingson S
What is a Content Authoring Tool and How to Choose the Right...	2023-10-25 00:00:00	Pradeepa somasundaram
Importance of Knowledge Management in the FMCG Industry	2023-10-25 00:00:00	Pradeepa somasundaram
How GenAI Will Enhance a Technical Writer’s Capabilities	2023-10-20 00:00:00	Selvaraaju Murugesan
Documentation in Accounting Firms: Trends and Innovations	2023-10-19 00:00:00	Pradeepa somasundaram
5 Best employee onboarding software for training new employees	2023-10-13 00:00:00	Jubina Prabhakaran
A Comprehensive Guide to Software Architecture Documentation	2023-10-12 00:00:00	Selvaraaju Murugesan
Release Notes: Why You Need Them and How to Write Them	2023-10-12 00:00:00	Kingson S
Transition to Technical Writing from Diverse Backgrounds wit...	2023-10-09 00:00:00	Gowri Ramkumar
Why Product Knowledge Matters in Customer Service	2023-09-30 00:00:00	Jubina Prabhakaran
What is product knowledge for sales team	2023-09-30 00:00:00	Jubina Prabhakaran
Detailed Comparison: Salesforce Vs Document360	2023-09-30 00:00:00	Arunkumar Kumaresan
Documentation for Testing: Benefits, Examples, and Best Prac...	2023-09-29 00:00:00	Kingson S
How Technical Writers Can Master Prompt Engineering	2023-09-29 00:00:00	Kingson S
A Quick Guide to Get Accurate ChatGPT Responses for Your FAQs	2023-09-29 00:00:00	Selvaraaju Murugesan
Introducing Postman Collection Support in Document360’...	2023-09-29 00:00:00	Shakeer Hussain
The Power of Organizational Learning and Collaboration with ...	2023-09-29 00:00:00	Pradeepa somasundaram
Knowledge management best practices in oil and gas industry	2023-09-28 00:00:00	Document360 Team
Top Online User Manual Tools for 2024	2023-09-20 00:00:00	Kingson S
Guide to Create Public Documentation: Importance, Examples &...	2023-09-20 00:00:00	Jubina Prabhakaran
Headless CMS Contentful vs. Document360	2023-09-15 00:00:00	Arunkumar Kumaresan
Top 7 Stonly Alternatives in 2024	2023-08-31 00:00:00	Pradeepa somasundaram
Author-it Vs Document360: A Detailed Comparison	2023-08-31 00:00:00	Pradeepa somasundaram
Documentation Version Control: How it can improve collaborat...	2023-08-31 00:00:00	Document360 Team
BetterDocs (WordPress) vs Document360: Which is better for k...	2023-08-31 00:00:00	Arunkumar Kumaresan
Role of Knowledge Management in Educational Institutions	2023-08-31 00:00:00	Pradeepa somasundaram
Pros and Cons of Custom Knowledge base	2023-08-30 00:00:00	Arunkumar Kumaresan
6 Key Tips for Successful Document Collaboration	2023-08-29 00:00:00	Document360 Team
Knowledge Management in HRM: Its Growing Importance & I...	2023-08-29 00:00:00	Jubina Prabhakaran
Implementing Effective Knowledge Management in the Aviation ...	2023-08-25 00:00:00	Pradeepa somasundaram
ChatGPT and the Future of Customer FAQs: Trends and Predictions	2023-08-22 00:00:00	Document360 Team
Role of ChatGPT plugins in the knowledge base	2023-08-16 00:00:00	Selvaraaju Murugesan
Revolutionizing Load Testing with Azure Load Test	2023-08-07 00:00:00	Divya Harinarayanan
How to build a documentation culture?	2023-07-31 00:00:00	Selvaraaju Murugesan
The Role of Knowledge management in E-commerce	2023-07-31 00:00:00	Jubina Prabhakaran
How to Localize Your Documentation for Global Audience	2023-07-28 00:00:00	Pradeepa somasundaram
Overcoming Barriers to Knowledge Management Adoption in the ...	2023-07-27 00:00:00	Pradeepa somasundaram
Pros and Cons of Docusaurus as a Documentation tool	2023-07-26 00:00:00	Arunkumar Kumaresan
SDK vs API: Choosing the Right Documentation Approach	2023-07-25 00:00:00	Mark Wentowski
Utilizing Technical Documentation to Facilitate Effective Co...	2023-07-20 00:00:00	Kingson S
On-Premise Knowledge Base – Pros, Cons and Alternatives	2023-07-20 00:00:00	Document360 Team
Document360’s Q2 2023 Feature Round-up	2023-07-18 00:00:00	Shakeer Hussain
API documentation: Components and Best Practices with Mark W...	2023-07-05 00:00:00	Gowri Ramkumar
Introduction to ChatGPT in Knowledge Management: Transformin...	2023-06-30 00:00:00	Document360 Team
Best practices in writing content for Generative AI-based ch...	2023-06-30 00:00:00	Selvaraaju Murugesan
What is Knowledge Management Framework & How to Create it?	2023-06-30 00:00:00	Document360 Team
Comprehensive Guide To Omnichannel Customer Service	2023-06-27 00:00:00	Document360 Team
Streamlining Content Journey: Effortless Title Recommendatio...	2023-06-26 00:00:00	Thiruthani Ravichandran
How to Create Multilingual Documentation	2023-06-26 00:00:00	Document360 Team
Seamlessly Maintain API Documentation integrity with the new...	2023-06-23 00:00:00	Shakeer Hussain
Top 6 Stoplight Alternatives in 2024	2023-06-22 00:00:00	Mark Wentowski
How Document360 Leverages Azure Virtual Network for Isolatio...	2023-06-21 00:00:00	Antonyraj Sebastin
What is the Role of Knowledge Management System In Finance	2023-06-21 00:00:00	Document360 Team
How Knowledge Management Streamlines Manufacturing Process?	2023-06-20 00:00:00	Document360 Team
Knowledge sharing and documentation metrics with Mysti Berry...	2023-06-15 00:00:00	Gowri Ramkumar
Introduction to APIs	2023-06-13 00:00:00	Mark Wentowski
What is the Role of Knowledge Management System In Retail In...	2023-05-31 00:00:00	Document360 Team
What is a Technical Writer Style Guide? With Examples	2023-05-31 00:00:00	Kingson S
How to implement an API strategy?	2023-05-30 00:00:00	Mark Wentowski
Top 8 Postman Alternatives to Consider for API Docs	2023-05-25 00:00:00	Mark Wentowski
8 Best GitBook Alternatives For 2024 with Reviews	2023-05-22 00:00:00	Document360 Team
8 Use Cases of ChatGPT for Customer Service	2023-05-19 00:00:00	Document360 Team
What is the API-First approach?	2023-05-19 00:00:00	Mark Wentowski
How to Test the Usability of Technical Documents with Tips &...	2023-05-19 00:00:00	Kingson S
Navigating Team Dynamics in Technical Writing with Yael Basf...	2023-05-18 00:00:00	Gowri Ramkumar
Introducing d360, a command line interface to streamline API...	2023-05-09 00:00:00	Suhas Parameshwara
How to Improve an Internal Processes in an Organization	2023-04-30 00:00:00	Pradeepa somasundaram
What Is Customer Self-Service? Benefits & Best Practices	2023-04-30 00:00:00	Pratiksha Ramkumar
Internal vs External APIs – Does it Matter?	2023-04-30 00:00:00	Mark Wentowski
The Future of Knowledge Base in the Age of Generative AI	2023-04-29 00:00:00	Selvaraaju Murugesan
GraphQL vs REST: How are they different?	2023-04-29 00:00:00	Mark Wentowski
Knowledge Management Strategy: How to Build One for Your Org...	2023-04-29 00:00:00	Jubina Prabhakaran
Role of ChatGPT in Software Documentation	2023-04-28 00:00:00	Selvaraaju Murugesan
Revolutionize your Knowledge Base with Article Health-Check ...	2023-04-27 00:00:00	Mohamed Shakheen
How Technical Writers Can Utilize ChatGPT?	2023-04-27 00:00:00	Kingson S
Discussing technical communication with Avi Chazen, Technica...	2023-04-27 00:00:00	Gowri Ramkumar
Test Automation Framework: How we built it for Document360	2023-04-13 00:00:00	Kuzhali Maheswaran
The Latest from Document360: Q1 2023 Release Highlights	2023-04-06 00:00:00	Shakeer Hussain
Top 6 SwaggerHub Alternatives in 2024	2023-04-03 00:00:00	Pradeepa somasundaram
What is Product Adoption with Metrics & KPI to Track	2023-03-30 00:00:00	Pradeepa somasundaram
What’s Customer Education in SaaS? Best Practices & Examples	2023-03-29 00:00:00	Pradeepa somasundaram
How To Create an Effective Sales Enablement Strategy	2023-03-29 00:00:00	Gowri Ramkumar
Documentation as Customer Success and Retention Tool with Is...	2023-03-28 00:00:00	Gowri Ramkumar
8 Important Types of Documentation for Product Management	2023-03-28 00:00:00	Shakeer Hussain
External Documentation: Best Practices, Tips & Example	2023-03-28 00:00:00	Jubina Prabhakaran
API Lifecycle Management: Everything You Need to Know	2023-03-22 00:00:00	Mark Wentowski
gRPC vs REST: What’s the difference?	2023-03-22 00:00:00	Mark Wentowski
Top 14 REST API Design Best Practices to Follow	2023-03-17 00:00:00	Shakeer Hussain
AI Tag Recommender: Quick and easy way of labelling articles	2023-03-16 00:00:00	Thiruthani Ravichandran
Hard skills vs soft skills in technical writing with Jonatha...	2023-03-10 00:00:00	Gowri Ramkumar
Create an enchanting API developer experience with the docum...	2023-03-08 00:00:00	Divya Harinarayanan
Introducing API Documentation: Enhance your API Experience	2023-03-08 00:00:00	Shakeer Hussain
Top 6 Paligo alternatives for 2024	2023-03-01 00:00:00	Pradeepa somasundaram
Concise Documentation: Definition, Benefits, and how to crea...	2023-02-28 00:00:00	Kingson S
The Ultimate Guide to Creating Customer Service Policy [Exam...	2023-02-28 00:00:00	Pradeepa somasundaram
Document360 is now SOC2 Type2 Certified	2023-02-28 00:00:00	Pratiksha Ramkumar
Guidelines for Deprecating Old API Versions	2023-02-28 00:00:00	Anand Murali
A Practical Guide to Create Technical Specification Document...	2023-02-27 00:00:00	Kingson S
What is a FinTech API?	2023-02-24 00:00:00	Shakeer Hussain
7 Essential Knowledge Management Metrics and How to use Them	2023-02-23 00:00:00	Jubina Prabhakaran
A Quality Checklist for API Documentation	2023-02-17 00:00:00	Shakeer Hussain
Practical guide to launching a new public API for your company	2023-02-09 00:00:00	Selvaraaju Murugesan
Best Alternative to Wix Answers Knowledge Management	2023-02-01 00:00:00	Pradeepa somasundaram
Create a delightful user experience with the Auto-register S...	2023-01-31 00:00:00	Thiruthani Ravichandran
How to create a Troubleshooting Guide for your business	2023-01-31 00:00:00	Kingson S
Document Development Life Cycle with Jessica Valero Gil, Se...	2023-01-31 00:00:00	Gowri Ramkumar
How To Create a Software Installation Guide For Your Customer	2023-01-31 00:00:00	Kingson S
Ultimate Guide To Create Customer Service Training Manual	2023-01-30 00:00:00	Pradeepa somasundaram
7 Knowledge Management Challenges and Solutions	2023-01-30 00:00:00	Jubina Prabhakaran
How to Create an Operation & Maintenance Manual	2023-01-28 00:00:00	Jubina Prabhakaran
The Ultimate Guide to Create a Business Playbook	2023-01-27 00:00:00	Selvaraaju Murugesan
Implicit Knowledge: What It Is, Benefits, How To Capture  ...	2023-01-23 00:00:00	Jubina Prabhakaran
What is API Developer Portal with Best Practices & Examples	2023-01-20 00:00:00	Shakeer Hussain
Document360’s Year in Review: 2022	2023-01-09 00:00:00	Pratiksha Ramkumar
What’s New with Document360: Q4 2022 Release Recap	2023-01-01 00:00:00	Shakeer Hussain
7 Best Alternatives To MadCap Flare	2023-01-01 00:00:00	Pradeepa somasundaram
REST vs. SOAP: What is the difference?	2022-12-31 00:00:00	Mark Wentowski
15 Steps to Create a Runbook for your Team	2022-12-31 00:00:00	Pradeepa somasundaram
Ultimate Guide To Build a Business Wiki	2022-12-29 00:00:00	Pradeepa somasundaram
Things You Should Be Aware While Creating Onboarding Documen...	2022-12-29 00:00:00	Jubina Prabhakaran
What is Open API? Advantages, Disadvantages & Examples	2022-12-28 00:00:00	Shakeer Hussain
Confluence VS Google Docs : A Detailed Review	2022-12-28 00:00:00	Pradeepa somasundaram
5 Tips to Create Information Architecture for Technical Writing	2022-12-26 00:00:00	Kingson S
6 Best API Documentation Tools for 2024	2022-12-23 00:00:00	Shakeer Hussain
Connect Document360 with any of your favorite apps via Make	2022-12-23 00:00:00	Shakeer Hussain
The Documentation Review Process: A Practical Guide	2022-12-22 00:00:00	Kingson S
User empathy while creating customer support documentation w...	2022-12-21 00:00:00	Gowri Ramkumar
100+ Customer Service Statistics You Should Know	2022-12-20 00:00:00	Jubina Prabhakaran
Glossary: A Valuable Resource for Knowledge Sharing	2022-12-19 00:00:00	Mohamed Shakheen
How to build style guides that enhances the customer journey...	2022-12-01 00:00:00	Gowri Ramkumar
Top 6 Slite alternatives to consider in 2024	2022-12-01 00:00:00	Pradeepa somasundaram
Swagger API: How They Work & What you Need to Know	2022-11-30 00:00:00	Shakeer Hussain
Knowledge Management Portal: Ultimate Guide with Examples	2022-11-30 00:00:00	Jubina Prabhakaran
Guide to Provide 24/7 Customer Service with Tips & Benefits	2022-11-29 00:00:00	Jubina Prabhakaran
Microsoft SharePoint Vs Google Docs: What’s the Difference?	2022-11-29 00:00:00	Pradeepa somasundaram
10 Top Standard Operating Procedure Software (SOP) for 2024	2022-11-28 00:00:00	Jubina Prabhakaran
How to Get Rid Of Information Silos	2022-11-26 00:00:00	Pradeepa somasundaram
How Does a REST API Work with Examples and Challenges	2022-11-25 00:00:00	Shakeer Hussain
Salesforce & Document360 – Instil wisdom into your CRM	2022-11-24 00:00:00	Shakeer Hussain
What is IT Documentation: Types, Examples & Templates	2022-11-18 00:00:00	Pradeepa somasundaram
7 Best Archbee Alternatives for 2024	2022-11-01 00:00:00	Pradeepa somasundaram
An Easy Guide to Creating an Effective Knowledge Transfer Pr...	2022-10-31 00:00:00	Jubina Prabhakaran
Organizational Silos: Overview, How to Break Down & Its Impact	2022-10-31 00:00:00	Pradeepa somasundaram
Agile Documentation: Methodology & Best Practices	2022-10-28 00:00:00	Selvaraaju Murugesan
Alex Fiedler from Torq discusses the role of documentation i...	2022-10-28 00:00:00	Gowri Ramkumar
How to Write API Documentation with Examples	2022-10-21 00:00:00	Kingson S
A Comprehensive Guide to Creating a Policy and Procedure Manual	2022-10-11 00:00:00	Jubina Prabhakaran
Quarterly round-up: A quick recap into Q3 2022	2022-10-07 00:00:00	Shakeer Hussain
7 Best Google Docs Alternative for 2024	2022-10-01 00:00:00	Pradeepa somasundaram
Step by Step Guide to Create Sales Documentation	2022-09-30 00:00:00	Gowri Ramkumar
Discussing technical writer career path with Lindsey Gilbert...	2022-09-29 00:00:00	Pradeepa somasundaram
Document Lifecycle: Ensuring Your Documentation Efficiency	2022-09-28 00:00:00	Kingson S
Ultimate Guide to Creating a Training Manuals	2022-09-22 00:00:00	Pradeepa somasundaram
Context Sensitive Help (CSH): What Is It?	2022-09-09 00:00:00	Kingson S
How to Measure the Value of Documentation?	2022-08-30 00:00:00	Selvaraaju Murugesan
How to craft exceptional documentation that attracts and ser...	2022-08-29 00:00:00	Pradeepa somasundaram
What is Application State Management and How Does it Matter?	2022-08-26 00:00:00	Mohamed Shakheen
Internal Documentation: How to Create, Tips & Examples	2022-08-18 00:00:00	Jubina Prabhakaran
Creating a Technical Manual: How, Types & Examples	2022-08-09 00:00:00	Kingson S
Top 7 KnowledgeOwl Alternatives in 2024	2022-08-03 00:00:00	Pradeepa somasundaram
Understanding Documentation Process Workflow with Sue Highmo...	2022-07-22 00:00:00	Gowri Ramkumar
Product Requirements Document: Benefits, Tips & Examples	2022-07-22 00:00:00	Shakeer Hussain
What Do You Need to Succeed as a Technical Writer with Ashok...	2022-07-15 00:00:00	Pradeepa somasundaram
What’s New with Document360: Q2 Release Recap	2022-07-13 00:00:00	Shakeer Hussain
Supercharge SEO with AI Powered Meta Description Generator	2022-07-11 00:00:00	Thiruthani Ravichandran
5 Examples of Customer Self Service Portal	2022-07-08 00:00:00	Jubina Prabhakaran
Top 7 ProProfs Knowledge Base Alternatives in 2024	2022-07-01 00:00:00	Pradeepa somasundaram
Starred Articles and Categories: An Effortless Access	2022-06-24 00:00:00	Thiruthani Ravichandran
Cybersecurity, UX Design, and SEO Documentation with Vivek P...	2022-06-23 00:00:00	Pradeepa somasundaram
10 Best Helpjuice Alternatives to Consider in 2024	2022-06-20 00:00:00	Jubina Prabhakaran
How we redesigned the analytics data processing in Document360	2022-06-15 00:00:00	Hariharan Subramanian
How to Create Project Documentation with Examples & Benefits	2022-06-14 00:00:00	Selvaraaju Murugesan
Building Trust on Blockchain by Writing Great Documentation ...	2022-06-03 00:00:00	Pradeepa somasundaram
Crowdin and Document360: An automated approach to create Mul...	2022-05-31 00:00:00	Shakeer Hussain
Enterprise Knowledge Management: Importance, Methods & Tools	2022-05-30 00:00:00	Sai Dheepika
The Ultimate Guide to Mobile App Customer Support [2024]	2022-05-27 00:00:00	Jubina Prabhakaran
Top 8 Guru Alternatives for Your Teams	2022-05-25 00:00:00	Pradeepa somasundaram
How to use data and analytics in your documentation team	2022-05-19 00:00:00	Selvaraaju Murugesan
Feature Explorer: An intuitive way to enhance product onboar...	2022-05-12 00:00:00	Mohamed Shakheen
Generate More Traffic to Your Document with Kathyana Rule, S...	2022-05-11 00:00:00	Pradeepa somasundaram
Top 7 ClickHelp Alternatives to consider in 2024	2022-05-10 00:00:00	Jubina Prabhakaran
Ultimate Guide to Law firm & Legal knowledge management	2022-05-06 00:00:00	Jubina Prabhakaran
Mastering Open Source Documentation with Abigail McCarthy, S...	2022-05-05 00:00:00	Pradeepa somasundaram
Feature Update: Full Portal Search	2022-05-02 00:00:00	Srividyaranjani Arumugam
Ultimate Guide to Create a Private Wiki	2022-04-26 00:00:00	Pradeepa somasundaram
Leveraging Automation to Create Structural and Consequential...	2022-04-26 00:00:00	Pradeepa somasundaram
Feature Update: Shared articles and Cloned articles	2022-04-22 00:00:00	Srividyaranjani Arumugam
Using Microsoft Teams and Slack as customer-centric tools	2022-04-13 00:00:00	Selvaraaju Murugesan
Developing a More Useful Technical Document with Anusmita Ra...	2022-04-11 00:00:00	Pradeepa somasundaram
Top 6 Bloomfire Alternatives for better Knowledge management	2022-04-10 00:00:00	Jubina Prabhakaran
10 Benefits of Creating SOP for Your Call Center	2022-04-08 00:00:00	Jubina Prabhakaran
Quarterly round-up: A look back into Q1 2022	2022-04-04 00:00:00	Srividyaranjani Arumugam
How to Create an Effective Product Onboarding Process	2022-04-01 00:00:00	Pradeepa somasundaram
Feature Update: Home Page Builder in a Knowledge Base	2022-03-29 00:00:00	Srividyaranjani Arumugam
How we Improved SEO Performance for Document360	2022-03-28 00:00:00	Hariharan Subramanian
Understanding Continuous Integration for Technical Documenta...	2022-03-25 00:00:00	Pradeepa somasundaram
Top 7 Confluence Alternatives to Explore in 2024	2022-03-21 00:00:00	Jubina Prabhakaran
Explicit Knowledge: Definition, Examples, and Methods	2022-03-18 00:00:00	Jubina Prabhakaran
Best Onboarding Practices For New Employee	2022-03-11 00:00:00	Jubina Prabhakaran
Qualities and Requirements to Become a Lead Technical Writer...	2022-03-08 00:00:00	Pradeepa somasundaram
How is knowledge management used in healthcare?	2022-03-04 00:00:00	Pradeepa somasundaram
How to write a Business Requirement Document (BRD)	2022-02-25 00:00:00	Selvaraaju Murugesan
Innovation and Multi-Dimension in Technical Documentation wi...	2022-02-25 00:00:00	Pradeepa somasundaram
How to write inclusive documentation?	2022-02-18 00:00:00	Selvaraaju Murugesan
Top 8 ECommerce Customer Service Best Practices to Follow	2022-02-11 00:00:00	Jubina Prabhakaran
Five-Step Formula for Effective Documentation with Shivam Gu...	2022-02-09 00:00:00	Pradeepa somasundaram
How to Write an Employee Handbook with Examples	2022-02-03 00:00:00	Pradeepa somasundaram
Feature update: Recycle bin in a Knowledge base	2022-02-01 00:00:00	Srividyaranjani Arumugam
How to create a good documentation strategy	2022-01-28 00:00:00	Selvaraaju Murugesan
The Fundamentals of Producing High-Quality Technical Documen...	2022-01-26 00:00:00	Gowri Ramkumar
How to Create Technical Documentation with Examples	2022-01-21 00:00:00	Kingson S
Ultimate Guide to write instruction for User Manual	2022-01-13 00:00:00	Jubina Prabhakaran
Document360’s Year in Review: 2021	2022-01-05 00:00:00	Srividyaranjani Arumugam
How to Create Document and Workflow for Business Process	2021-12-31 00:00:00	Selvaraaju Murugesan
Documentation Planning and Organized Execution with Mark Sel...	2021-12-31 00:00:00	Pradeepa somasundaram
What is Tacit Knowledge: Importance, Benefits & Examples	2021-12-24 00:00:00	Jubina Prabhakaran
Most Popular Online FAQ Tools & Software Compared	2021-12-17 00:00:00	Pradeepa somasundaram
Create High-Quality Technical Content with a Non-Technical B...	2021-12-17 00:00:00	Pradeepa somasundaram
How to re-use your content with Snippets and Variables	2021-12-14 00:00:00	Srividyaranjani Arumugam
15 Best Wiki Software Tools For 2024	2021-12-06 00:00:00	Jubina Prabhakaran
How to enable and use the Integrately Document360 Integration	2021-11-30 00:00:00	Pradeepa somasundaram
What is Knowledge Centered Service (KCS): Complete Guide	2021-11-26 00:00:00	Jubina Prabhakaran
Broadening Your Skill Set as a Technical Writer with Nicola ...	2021-11-26 00:00:00	Pradeepa somasundaram
Importance of Knowledge Management in business model innovation	2021-11-11 00:00:00	Selvaraaju Murugesan
Importance of Page Not Found Analytics in your Knowledge Base	2021-11-03 00:00:00	Srividyaranjani Arumugam
The Role of Artificial Intelligence (AI) in Transforming Tec...	2021-10-29 00:00:00	Gowri Ramkumar
How to analyze knowledge base performance	2021-10-29 00:00:00	Srividyaranjani Arumugam
How to Create An Internal Wiki: Types, Benefits & Tools	2021-10-22 00:00:00	Jubina Prabhakaran
7 challenges in technical writing and how to overcome them	2021-10-15 00:00:00	Kingson S
Importance of business glossary in knowledge management	2021-10-08 00:00:00	Selvaraaju Murugesan
How to use Zapier Integration to Connect your Apps with Docu...	2021-10-01 00:00:00	Pradeepa somasundaram
Managing Documentation Workflows with Matthew Buttler, Senio...	2021-09-29 00:00:00	Gowri Ramkumar
Quarterly round-up: A look back into Q3 2021	2021-09-27 00:00:00	Srividyaranjani Arumugam
How to Manage Internal Communication and Engage with the Cus...	2021-09-15 00:00:00	Gowri Ramkumar
Cool features to improve your knowledge base user experience	2021-09-13 00:00:00	Srividyaranjani Arumugam
Ease your link validation process with Ignore URL	2021-09-03 00:00:00	Srividyaranjani Arumugam
Software VS Hardware Technical Documentation with Idan Engla...	2021-09-01 00:00:00	Gowri Ramkumar
The ultimate guide to help center knowledge base software	2021-08-31 00:00:00	Pradeepa somasundaram
Integrating your chatbot with a knowledge base	2021-08-27 00:00:00	Pradeepa somasundaram
Ticket Deflector Analytics: Measure your Metrics	2021-08-25 00:00:00	Selvaraaju Murugesan
How to beautify your knowledge base site	2021-08-19 00:00:00	Selvaraaju Murugesan
Fundamentals of Creating High-Quality Documentation with Ram...	2021-08-18 00:00:00	Gowri Ramkumar
How to Enhance Internal Communication using a Knowledge Base	2021-08-17 00:00:00	Jubina Prabhakaran
How to optimize the search feature in the knowledge base	2021-08-10 00:00:00	Selvaraaju Murugesan
Building a Promising Technical Writing Career with Michael G...	2021-08-06 00:00:00	Gowri Ramkumar
Top 20 Software Documentation Tools of 2024	2021-07-30 00:00:00	Pradeepa somasundaram
The Importance of Consistency in Technical Documentation Wit...	2021-07-26 00:00:00	Gowri Ramkumar
The benefits of standalone knowledge base software for your ...	2021-07-20 00:00:00	Jubina Prabhakaran
Knowledge base assistant – Your customized 24/7 support	2021-07-16 00:00:00	Selvaraaju Murugesan
Building a Successful Knowledge mapping within Knowledge man...	2021-07-12 00:00:00	Pradeepa somasundaram
Thirty-Three Rules of API Documentation with Robert Delwood,...	2021-07-09 00:00:00	Gowri Ramkumar
How to create Oustanding FAQ pages for your Customer Support?	2021-07-07 00:00:00	Pradeepa somasundaram
AI powered Knowledge base in rapidly changing world	2021-06-30 00:00:00	Selvaraaju Murugesan
How to Document your change management process?	2021-06-29 00:00:00	Jubina Prabhakaran
How to find and fix broken links on your knowledge base	2021-06-28 00:00:00	Document360 Team
What’s new in Document360? – May 2021 Product update	2021-06-24 00:00:00	Kingson S
Managing Distributed, Non-Linear Documentation Workflows wit...	2021-06-24 00:00:00	Gowri Ramkumar
